"","category","numDEInCat","numInCat","padj","Term"
"21746","GO:0055011",0,1,1,"atrial cardiac muscle cell differentiation"
"21748","GO:0055012",0,19,1,"ventricular cardiac muscle cell differentiation"
"21750","GO:0055013",0,23,1,"cardiac muscle cell development"
"21752","GO:0055014",0,1,1,"atrial cardiac muscle cell development"
"21754","GO:0055015",0,8,1,"ventricular cardiac muscle cell development"
"21756","GO:0055017",0,36,1,"cardiac muscle tissue growth"
"21757","GO:0055018",0,1,1,"regulation of cardiac muscle fiber development"
"21759","GO:0055020",0,1,1,"positive regulation of cardiac muscle fiber development"
"21766","GO:0055021",0,21,1,"regulation of cardiac muscle tissue growth"
"21767","GO:0055022",0,1,1,"negative regulation of cardiac muscle tissue growth"
"21772","GO:0055023",0,1,1,"positive regulation of cardiac muscle tissue growth"
"21778","GO:0055024",0,28,1,"regulation of cardiac muscle tissue development"
"21779","GO:0055025",0,2,1,"positive regulation of cardiac muscle tissue development"
"21785","GO:0055026",0,1,1,"negative regulation of cardiac muscle tissue development"
"21790","GO:0055057",0,8,1,"neuroblast division"
"21791","GO:0055059",0,3,1,"asymmetric neuroblast division"
"21792","GO:0055062",0,3,1,"phosphate ion homeostasis"
"21793","GO:0055064",0,2,1,"chloride ion homeostasis"
"21794","GO:0055065",2,244,1,"metal ion homeostasis"
"21795","GO:0055067",0,54,1,"monovalent inorganic cation homeostasis"
"21796","GO:0055069",0,14,1,"zinc ion homeostasis"
"21797","GO:0055070",0,14,1,"copper ion homeostasis"
"21798","GO:0055071",0,1,1,"manganese ion homeostasis"
"21799","GO:0055072",1,77,1,"iron ion homeostasis"
"21800","GO:0055073",0,1,1,"cadmium ion homeostasis"
"21801","GO:0055074",1,176,1,"calcium ion homeostasis"
"21802","GO:0055075",0,1,1,"potassium ion homeostasis"
"21803","GO:0055076",0,1,1,"transition metal ion homeostasis"
"21804","GO:0055078",0,15,1,"sodium ion homeostasis"
"21805","GO:0055080",2,317,1,"cation homeostasis"
"21806","GO:0055081",0,16,1,"anion homeostasis"
"21807","GO:0055082",3,498,1,"cellular chemical homeostasis"
"21808","GO:0055083",0,2,1,"monovalent inorganic anion homeostasis"
"21809","GO:0055085",6,546,1,"transmembrane transport"
"21810","GO:0055086",6,771,1,"nucleobase-containing small molecule metabolic process"
"21812","GO:0055088",0,70,1,"lipid homeostasis"
"21813","GO:0055089",0,10,1,"fatty acid homeostasis"
"21814","GO:0055090",0,14,1,"acylglycerol homeostasis"
"21815","GO:0055091",0,5,1,"phospholipid homeostasis"
"21816","GO:0055092",0,47,1,"sterol homeostasis"
"21817","GO:0055093",0,16,1,"response to hyperoxia"
"21819","GO:0055094",0,9,1,"response to lipoprotein particle stimulus"
"21820","GO:0055095",0,2,1,"lipoprotein particle mediated signaling"
"21821","GO:0055096",0,2,1,"low-density lipoprotein particle mediated signaling"
"21822","GO:0055098",0,6,1,"response to low-density lipoprotein particle stimulus"
"21823","GO:0055099",0,2,1,"response to high density lipoprotein particle stimulus"
"21824","GO:0055114",5,516,1,"oxidation-reduction process"
"21826","GO:0055117",0,41,1,"regulation of cardiac muscle contraction"
"21827","GO:0055118",0,3,1,"negative regulation of cardiac muscle contraction"
"21828","GO:0055119",0,7,1,"relaxation of cardiac muscle"
"21829","GO:0055123",1,74,1,"digestive system development"
"21830","GO:0055129",0,4,1,"L-proline biosynthetic process"
"21831","GO:0060003",0,1,1,"copper ion export"
"21832","GO:0060004",0,8,1,"reflex"
"21833","GO:0060005",0,2,1,"vestibular reflex"
"21834","GO:0060008",0,4,1,"Sertoli cell differentiation"
"21835","GO:0060009",0,3,1,"Sertoli cell development"
"21836","GO:0060010",0,1,1,"Sertoli cell fate commitment"
"21837","GO:0060011",0,3,1,"Sertoli cell proliferation"
"21838","GO:0060012",0,1,1,"synaptic transmission, glycinergic"
"21839","GO:0060013",0,3,1,"righting reflex"
"21840","GO:0060014",0,1,1,"granulosa cell differentiation"
"21841","GO:0060017",0,5,1,"parathyroid gland development"
"21842","GO:0060018",0,2,1,"astrocyte fate commitment"
"21843","GO:0060019",0,5,1,"radial glial cell differentiation"
"21844","GO:0060020",0,1,1,"Bergmann glial cell differentiation"
"21845","GO:0060021",0,57,1,"palate development"
"21846","GO:0060022",0,3,1,"hard palate development"
"21847","GO:0060023",0,9,1,"soft palate development"
"21849","GO:0060024",0,3,1,"rhythmic synaptic transmission"
"21850","GO:0060025",0,1,1,"regulation of synaptic activity"
"21851","GO:0060026",1,17,1,"convergent extension"
"21852","GO:0060027",0,4,1,"convergent extension involved in gastrulation"
"21854","GO:0060029",0,6,1,"convergent extension involved in organogenesis"
"21855","GO:0060032",0,2,1,"notochord regression"
"21856","GO:0060033",0,6,1,"anatomical structure regression"
"21857","GO:0060034",0,1,1,"notochord cell differentiation"
"21858","GO:0060035",0,1,1,"notochord cell development"
"21859","GO:0060037",0,10,1,"pharyngeal system development"
"21860","GO:0060038",0,32,1,"cardiac muscle cell proliferation"
"21863","GO:0060039",0,13,1,"pericardium development"
"21864","GO:0060040",0,1,1,"retinal bipolar neuron differentiation"
"21865","GO:0060041",0,62,1,"retina development in camera-type eye"
"21868","GO:0060042",0,16,1,"retina morphogenesis in camera-type eye"
"21870","GO:0060043",0,19,1,"regulation of cardiac muscle cell proliferation"
"21872","GO:0060044",0,5,1,"negative regulation of cardiac muscle cell proliferation"
"21873","GO:0060045",0,14,1,"positive regulation of cardiac muscle cell proliferation"
"21874","GO:0060046",0,4,1,"regulation of acrosome reaction"
"21875","GO:0060047",0,97,1,"heart contraction"
"21878","GO:0060048",0,44,1,"cardiac muscle contraction"
"21879","GO:0060049",0,7,1,"regulation of protein glycosylation"
"21880","GO:0060050",0,2,1,"positive regulation of protein glycosylation"
"21881","GO:0060051",0,3,1,"negative regulation of protein glycosylation"
"21882","GO:0060052",0,4,1,"neurofilament cytoskeleton organization"
"21884","GO:0060054",0,3,1,"positive regulation of epithelial cell proliferation involved in wound healing"
"21885","GO:0060055",0,12,1,"angiogenesis involved in wound healing"
"21886","GO:0060056",0,6,1,"mammary gland involution"
"21887","GO:0060057",0,2,1,"apoptotic process involved in mammary gland involution"
"21888","GO:0060058",0,2,1,"positive regulation of apoptotic process involved in mammary gland involution"
"21889","GO:0060059",0,6,1,"embryonic retina morphogenesis in camera-type eye"
"21890","GO:0060061",0,1,1,"Spemann organizer formation"
"21892","GO:0060065",0,10,1,"uterus development"
"21893","GO:0060066",0,1,1,"oviduct development"
"21895","GO:0060067",0,1,1,"cervix development"
"21896","GO:0060068",0,10,1,"vagina development"
"21897","GO:0060070",1,153,1,"canonical Wnt receptor signaling pathway"
"21902","GO:0060071",1,25,1,"Wnt receptor signaling pathway, planar cell polarity pathway"
"21907","GO:0060073",0,5,1,"micturition"
"21909","GO:0060074",0,8,1,"synapse maturation"
"21910","GO:0060075",0,1,1,"regulation of resting membrane potential"
"21911","GO:0060078",0,26,1,"regulation of postsynaptic membrane potential"
"21912","GO:0060079",0,25,1,"regulation of excitatory postsynaptic membrane potential"
"21914","GO:0060080",0,5,1,"regulation of inhibitory postsynaptic membrane potential"
"21916","GO:0060081",0,8,1,"membrane hyperpolarization"
"21917","GO:0060082",0,1,1,"eye blink reflex"
"21918","GO:0060083",0,3,1,"smooth muscle contraction involved in micturition"
"21920","GO:0060084",0,1,1,"synaptic transmission involved in micturition"
"21921","GO:0060086",0,1,1,"circadian temperature homeostasis"
"21923","GO:0060087",0,5,1,"relaxation of vascular smooth muscle"
"21924","GO:0060088",0,6,1,"auditory receptor cell stereocilium organization"
"21926","GO:0060096",0,1,1,"serotonin secretion, neurotransmission"
"21927","GO:0060099",0,2,1,"regulation of phagocytosis, engulfment"
"21928","GO:0060100",0,2,1,"positive regulation of phagocytosis, engulfment"
"21929","GO:0060112",0,1,1,"generation of ovulation cycle rhythm"
"21932","GO:0060113",0,32,1,"inner ear receptor cell differentiation"
"21933","GO:0060117",0,11,1,"auditory receptor cell development"
"21934","GO:0060119",0,18,1,"inner ear receptor cell development"
"21935","GO:0060120",0,3,1,"inner ear receptor cell fate commitment"
"21936","GO:0060122",0,10,1,"inner ear receptor stereocilium organization"
"21939","GO:0060123",0,5,1,"regulation of growth hormone secretion"
"21940","GO:0060124",0,2,1,"positive regulation of growth hormone secretion"
"21941","GO:0060125",0,1,1,"negative regulation of growth hormone secretion"
"21942","GO:0060128",0,2,1,"corticotropin hormone secreting cell differentiation"
"21947","GO:0060129",0,2,1,"thyroid-stimulating hormone-secreting cell differentiation"
"21952","GO:0060134",0,4,1,"prepulse inhibition"
"21954","GO:0060135",1,40,1,"maternal process involved in female pregnancy"
"21955","GO:0060136",0,8,1,"embryonic process involved in female pregnancy"
"21956","GO:0060137",0,5,1,"maternal process involved in parturition"
"21957","GO:0060142",0,3,1,"regulation of syncytium formation by plasma membrane fusion"
"21958","GO:0060143",0,2,1,"positive regulation of syncytium formation by plasma membrane fusion"
"21959","GO:0060147",0,12,1,"regulation of posttranscriptional gene silencing"
"21960","GO:0060148",0,3,1,"positive regulation of posttranscriptional gene silencing"
"21961","GO:0060149",0,8,1,"negative regulation of posttranscriptional gene silencing"
"21962","GO:0060151",0,2,1,"peroxisome localization"
"21963","GO:0060152",0,2,1,"microtubule-based peroxisome localization"
"21964","GO:0060154",0,3,1,"cellular process regulating host cell cycle in response to virus"
"21965","GO:0060155",0,6,1,"platelet dense granule organization"
"21969","GO:0060157",0,3,1,"urinary bladder development"
"21970","GO:0060158",0,5,1,"phospholipase C-activating dopamine receptor signaling pathway"
"21973","GO:0060159",0,4,1,"regulation of dopamine receptor signaling pathway"
"21974","GO:0060160",0,1,1,"negative regulation of dopamine receptor signaling pathway"
"21975","GO:0060161",0,2,1,"positive regulation of dopamine receptor signaling pathway"
"21976","GO:0060164",0,2,1,"regulation of timing of neuron differentiation"
"21977","GO:0060166",0,1,1,"olfactory pit development"
"21978","GO:0060167",0,1,1,"regulation of adenosine receptor signaling pathway"
"21979","GO:0060169",0,1,1,"negative regulation of adenosine receptor signaling pathway"
"21980","GO:0060173",0,111,1,"limb development"
"21981","GO:0060174",0,6,1,"limb bud formation"
"21983","GO:0060177",0,6,1,"regulation of angiotensin metabolic process"
"21984","GO:0060178",0,3,1,"regulation of exocyst localization"
"21985","GO:0060179",0,2,1,"male mating behavior"
"21986","GO:0060180",0,4,1,"female mating behavior"
"21987","GO:0060191",1,90,1,"regulation of lipase activity"
"21988","GO:0060192",0,8,1,"negative regulation of lipase activity"
"21989","GO:0060193",0,70,1,"positive regulation of lipase activity"
"21990","GO:0060197",0,2,1,"cloacal septation"
"21992","GO:0060211",0,2,1,"regulation of nuclear-transcribed mRNA poly(A) tail shortening"
"21995","GO:0060213",0,2,1,"positive regulation of nuclear-transcribed mRNA poly(A) tail shortening"
"21998","GO:0060214",0,3,1,"endocardium formation"
"21999","GO:0060215",0,7,1,"primitive hemopoiesis"
"22002","GO:0060216",0,18,1,"definitive hemopoiesis"
"22005","GO:0060217",0,1,1,"hemangioblast cell differentiation"
"22006","GO:0060218",1,8,1,"hematopoietic stem cell differentiation"
"22009","GO:0060219",0,4,1,"camera-type eye photoreceptor cell differentiation"
"22010","GO:0060221",0,1,1,"retinal rod cell differentiation"
"22011","GO:0060231",0,11,1,"mesenchymal to epithelial transition"
"22012","GO:0060235",0,3,1,"lens induction in camera-type eye"
"22013","GO:0060236",0,5,1,"regulation of mitotic spindle organization"
"22015","GO:0060242",0,7,1,"contact inhibition"
"22016","GO:0060244",0,3,1,"negative regulation of cell proliferation involved in contact inhibition"
"22017","GO:0060245",0,1,1,"detection of cell density"
"22018","GO:0060246",0,1,1,"detection of cell density by contact stimulus"
"22019","GO:0060248",0,1,1,"detection of cell density by contact stimulus involved in contact inhibition"
"22020","GO:0060249",0,160,1,"anatomical structure homeostasis"
"22021","GO:0060251",0,12,1,"regulation of glial cell proliferation"
"22022","GO:0060252",0,7,1,"positive regulation of glial cell proliferation"
"22023","GO:0060253",0,6,1,"negative regulation of glial cell proliferation"
"22024","GO:0060255",11,3656,1,"regulation of macromolecule metabolic process"
"22025","GO:0060259",0,2,1,"regulation of feeding behavior"
"22026","GO:0060260",0,12,1,"regulation of transcription initiation from RNA polymerase II promoter"
"22027","GO:0060261",0,4,1,"positive regulation of transcription initiation from RNA polymerase II promoter"
"22028","GO:0060263",0,7,1,"regulation of respiratory burst"
"22029","GO:0060264",0,2,1,"regulation of respiratory burst involved in inflammatory response"
"22030","GO:0060265",0,1,1,"positive regulation of respiratory burst involved in inflammatory response"
"22031","GO:0060266",0,1,1,"negative regulation of respiratory burst involved in inflammatory response"
"22032","GO:0060267",0,3,1,"positive regulation of respiratory burst"
"22033","GO:0060268",0,1,1,"negative regulation of respiratory burst"
"22034","GO:0060271",0,98,1,"cilium morphogenesis"
"22035","GO:0060272",0,11,1,"embryonic skeletal joint morphogenesis"
"22036","GO:0060278",0,2,1,"regulation of ovulation"
"22037","GO:0060279",0,2,1,"positive regulation of ovulation"
"22038","GO:0060281",0,2,1,"regulation of oocyte development"
"22039","GO:0060282",0,2,1,"positive regulation of oocyte development"
"22040","GO:0060284",2,371,1,"regulation of cell development"
"22041","GO:0060285",0,8,1,"ciliary cell motility"
"22042","GO:0060286",0,3,1,"flagellar cell motility"
"22043","GO:0060287",0,4,1,"epithelial cilium movement involved in determination of left/right asymmetry"
"22044","GO:0060290",0,2,1,"transdifferentiation"
"22045","GO:0060291",0,14,1,"long-term synaptic potentiation"
"22047","GO:0060292",0,7,1,"long term synaptic depression"
"22049","GO:0060294",0,4,1,"cilium movement involved in cell motility"
"22050","GO:0060295",0,4,1,"regulation of cilium movement involved in cell motility"
"22051","GO:0060296",0,4,1,"regulation of cilium beat frequency involved in ciliary motility"
"22052","GO:0060297",0,1,1,"regulation of sarcomere organization"
"22053","GO:0060298",0,1,1,"positive regulation of sarcomere organization"
"22054","GO:0060300",0,1,1,"regulation of cytokine activity"
"22055","GO:0060301",0,1,1,"positive regulation of cytokine activity"
"22056","GO:0060305",0,1,1,"regulation of cell diameter"
"22057","GO:0060306",0,8,1,"regulation of membrane repolarization"
"22058","GO:0060307",0,5,1,"regulation of ventricular cardiac muscle cell membrane repolarization"
"22063","GO:0060309",0,1,1,"elastin catabolic process"
"22066","GO:0060310",0,1,1,"regulation of elastin catabolic process"
"22069","GO:0060311",0,1,1,"negative regulation of elastin catabolic process"
"22073","GO:0060312",0,3,1,"regulation of blood vessel remodeling"
"22074","GO:0060313",0,1,1,"negative regulation of blood vessel remodeling"
"22076","GO:0060314",0,17,1,"regulation of ryanodine-sensitive calcium-release channel activity"
"22077","GO:0060315",0,11,1,"negative regulation of ryanodine-sensitive calcium-release channel activity"
"22078","GO:0060316",0,8,1,"positive regulation of ryanodine-sensitive calcium-release channel activity"
"22079","GO:0060317",0,15,1,"cardiac epithelial to mesenchymal transition"
"22080","GO:0060318",0,5,1,"definitive erythrocyte differentiation"
"22083","GO:0060319",0,3,1,"primitive erythrocyte differentiation"
"22086","GO:0060322",0,39,1,"head development"
"22087","GO:0060323",0,24,1,"head morphogenesis"
"22088","GO:0060324",0,29,1,"face development"
"22089","GO:0060325",0,22,1,"face morphogenesis"
"22090","GO:0060326",0,122,1,"cell chemotaxis"
"22091","GO:0060327",0,1,1,"cytoplasmic actin-based contraction involved in cell motility"
"22092","GO:0060330",0,23,1,"regulation of response to interferon-gamma"
"22096","GO:0060331",0,4,1,"negative regulation of response to interferon-gamma"
"22100","GO:0060332",0,3,1,"positive regulation of response to interferon-gamma"
"22109","GO:0060334",0,22,1,"regulation of interferon-gamma-mediated signaling pathway"
"22114","GO:0060335",0,3,1,"positive regulation of interferon-gamma-mediated signaling pathway"
"22119","GO:0060336",0,4,1,"negative regulation of interferon-gamma-mediated signaling pathway"
"22125","GO:0060338",0,19,1,"regulation of type I interferon-mediated signaling pathway"
"22126","GO:0060339",0,2,1,"negative regulation of type I interferon-mediated signaling pathway"
"22127","GO:0060340",0,5,1,"positive regulation of type I interferon-mediated signaling pathway"
"22129","GO:0060343",1,19,1,"trabecula formation"
"22131","GO:0060345",0,1,1,"spleen trabecula formation"
"22138","GO:0060347",0,11,1,"heart trabecula formation"
"22142","GO:0060348",1,79,1,"bone development"
"22143","GO:0060349",0,54,1,"bone morphogenesis"
"22144","GO:0060350",0,34,1,"endochondral bone morphogenesis"
"22145","GO:0060351",0,18,1,"cartilage development involved in endochondral bone morphogenesis"
"22146","GO:0060356",0,1,1,"leucine import"
"22149","GO:0060359",0,33,1,"response to ammonium ion"
"22150","GO:0060363",0,8,1,"cranial suture morphogenesis"
"22151","GO:0060364",0,3,1,"frontal suture morphogenesis"
"22152","GO:0060365",0,1,1,"coronal suture morphogenesis"
"22153","GO:0060366",0,1,1,"lambdoid suture morphogenesis"
"22154","GO:0060367",0,1,1,"sagittal suture morphogenesis"
"22155","GO:0060368",0,4,1,"regulation of Fc receptor mediated stimulatory signaling pathway"
"22156","GO:0060369",0,2,1,"positive regulation of Fc receptor mediated stimulatory signaling pathway"
"22157","GO:0060370",0,2,1,"susceptibility to T cell mediated cytotoxicity"
"22158","GO:0060371",0,4,1,"regulation of atrial cardiac muscle cell membrane depolarization"
"22162","GO:0060372",0,1,1,"regulation of atrial cardiac muscle cell membrane repolarization"
"22166","GO:0060373",0,5,1,"regulation of ventricular cardiac muscle cell membrane depolarization"
"22169","GO:0060374",0,6,1,"mast cell differentiation"
"22170","GO:0060375",0,3,1,"regulation of mast cell differentiation"
"22171","GO:0060376",0,1,1,"positive regulation of mast cell differentiation"
"22172","GO:0060377",0,1,1,"negative regulation of mast cell differentiation"
"22173","GO:0060379",0,8,1,"cardiac muscle cell myoblast differentiation"
"22175","GO:0060380",0,1,1,"regulation of single-stranded telomeric DNA binding"
"22176","GO:0060381",0,1,1,"positive regulation of single-stranded telomeric DNA binding"
"22177","GO:0060382",0,1,1,"regulation of DNA strand elongation"
"22178","GO:0060383",0,1,1,"positive regulation of DNA strand elongation"
"22179","GO:0060384",0,6,1,"innervation"
"22180","GO:0060385",0,1,1,"axonogenesis involved in innervation"
"22181","GO:0060389",0,35,1,"pathway-restricted SMAD protein phosphorylation"
"22182","GO:0060390",0,18,1,"regulation of SMAD protein import into nucleus"
"22183","GO:0060391",0,16,1,"positive regulation of SMAD protein import into nucleus"
"22184","GO:0060392",0,1,1,"negative regulation of SMAD protein import into nucleus"
"22185","GO:0060393",0,31,1,"regulation of pathway-restricted SMAD protein phosphorylation"
"22186","GO:0060394",0,4,1,"negative regulation of pathway-restricted SMAD protein phosphorylation"
"22187","GO:0060395",0,12,1,"SMAD protein signal transduction"
"22188","GO:0060396",0,22,1,"growth hormone receptor signaling pathway"
"22191","GO:0060397",0,18,1,"JAK-STAT cascade involved in growth hormone signaling pathway"
"22192","GO:0060398",0,2,1,"regulation of growth hormone receptor signaling pathway"
"22193","GO:0060399",0,1,1,"positive regulation of growth hormone receptor signaling pathway"
"22194","GO:0060400",0,1,1,"negative regulation of growth hormone receptor signaling pathway"
"22195","GO:0060401",0,63,1,"cytosolic calcium ion transport"
"22196","GO:0060402",0,62,1,"calcium ion transport into cytosol"
"22197","GO:0060404",0,1,1,"axonemal microtubule depolymerization"
"22198","GO:0060405",0,3,1,"regulation of penile erection"
"22199","GO:0060406",0,1,1,"positive regulation of penile erection"
"22200","GO:0060407",0,1,1,"negative regulation of penile erection"
"22201","GO:0060411",0,35,1,"cardiac septum morphogenesis"
"22203","GO:0060412",0,24,1,"ventricular septum morphogenesis"
"22204","GO:0060413",0,10,1,"atrial septum morphogenesis"
"22206","GO:0060414",0,1,1,"aorta smooth muscle tissue morphogenesis"
"22207","GO:0060415",0,35,1,"muscle tissue morphogenesis"
"22208","GO:0060416",0,25,1,"response to growth hormone stimulus"
"22209","GO:0060419",0,39,1,"heart growth"
"22210","GO:0060420",0,23,1,"regulation of heart growth"
"22211","GO:0060421",0,2,1,"positive regulation of heart growth"
"22212","GO:0060423",0,3,1,"foregut regionalization"
"22213","GO:0060424",0,3,1,"lung field specification"
"22214","GO:0060425",0,29,1,"lung morphogenesis"
"22215","GO:0060426",0,5,1,"lung vasculature development"
"22216","GO:0060428",0,19,1,"lung epithelium development"
"22217","GO:0060429",4,430,1,"epithelium development"
"22218","GO:0060430",0,4,1,"lung saccule development"
"22219","GO:0060431",0,5,1,"primary lung bud formation"
"22220","GO:0060432",0,1,1,"lung pattern specification process"
"22221","GO:0060433",0,3,1,"bronchus development"
"22222","GO:0060434",0,1,1,"bronchus morphogenesis"
"22223","GO:0060435",0,2,1,"bronchiole development"
"22224","GO:0060436",0,1,1,"bronchiole morphogenesis"
"22225","GO:0060437",0,3,1,"lung growth"
"22226","GO:0060438",0,7,1,"trachea development"
"22227","GO:0060439",0,5,1,"trachea morphogenesis"
"22228","GO:0060440",0,3,1,"trachea formation"
"22229","GO:0060441",0,17,1,"epithelial tube branching involved in lung morphogenesis"
"22230","GO:0060442",1,10,1,"branching involved in prostate gland morphogenesis"
"22232","GO:0060443",1,48,1,"mammary gland morphogenesis"
"22233","GO:0060444",1,25,1,"branching involved in mammary gland duct morphogenesis"
"22234","GO:0060445",0,20,1,"branching involved in salivary gland morphogenesis"
"22235","GO:0060447",0,2,1,"bud outgrowth involved in lung branching"
"22236","GO:0060448",0,3,1,"dichotomous subdivision of terminal units involved in lung branching"
"22237","GO:0060449",0,3,1,"bud elongation involved in lung branching"
"22238","GO:0060452",0,4,1,"positive regulation of cardiac muscle contraction"
"22239","GO:0060453",0,1,1,"regulation of gastric acid secretion"
"22240","GO:0060456",0,5,1,"positive regulation of digestive system process"
"22241","GO:0060457",0,3,1,"negative regulation of digestive system process"
"22242","GO:0060459",0,1,1,"left lung development"
"22243","GO:0060460",0,1,1,"left lung morphogenesis"
"22244","GO:0060462",0,4,1,"lung lobe development"
"22245","GO:0060463",0,4,1,"lung lobe morphogenesis"
"22246","GO:0060465",0,1,1,"pharynx development"
"22247","GO:0060466",0,1,1,"activation of meiosis involved in egg activation"
"22249","GO:0060467",0,1,1,"negative regulation of fertilization"
"22250","GO:0060468",0,1,1,"prevention of polyspermy"
"22252","GO:0060478",0,1,1,"acrosomal vesicle exocytosis"
"22254","GO:0060479",0,11,1,"lung cell differentiation"
"22255","GO:0060480",0,1,1,"lung goblet cell differentiation"
"22256","GO:0060481",0,1,1,"lobar bronchus epithelium development"
"22257","GO:0060482",0,1,1,"lobar bronchus development"
"22258","GO:0060484",0,6,1,"lung-associated mesenchyme development"
"22260","GO:0060485",1,114,1,"mesenchyme development"
"22261","GO:0060486",0,2,1,"Clara cell differentiation"
"22262","GO:0060487",0,10,1,"lung epithelial cell differentiation"
"22263","GO:0060488",0,2,1,"orthogonal dichotomous subdivision of terminal units involved in lung branching morphogenesis"
"22264","GO:0060489",0,2,1,"planar dichotomous subdivision of terminal units involved in lung branching morphogenesis"
"22265","GO:0060490",0,2,1,"lateral sprouting involved in lung morphogenesis"
"22266","GO:0060491",0,48,1,"regulation of cell projection assembly"
"22267","GO:0060492",0,3,1,"lung induction"
"22268","GO:0060495",0,1,1,"cell-cell signaling involved in lung development"
"22269","GO:0060496",0,1,1,"mesenchymal-epithelial cell signaling involved in lung development"
"22270","GO:0060501",0,5,1,"positive regulation of epithelial cell proliferation involved in lung morphogenesis"
"22271","GO:0060502",0,7,1,"epithelial cell proliferation involved in lung morphogenesis"
"22272","GO:0060503",0,1,1,"bud dilation involved in lung branching"
"22273","GO:0060509",0,2,1,"Type I pneumocyte differentiation"
"22276","GO:0060510",0,5,1,"Type II pneumocyte differentiation"
"22284","GO:0060516",0,1,1,"primary prostatic bud elongation"
"22286","GO:0060517",0,1,1,"epithelial cell proliferation involved in prostatic bud elongation"
"22288","GO:0060523",0,2,1,"prostate epithelial cord elongation"
"22289","GO:0060525",1,8,1,"prostate glandular acinus development"
"22292","GO:0060528",0,3,1,"secretory columnal luminar epithelial cell differentiation involved in prostate glandular acinus development"
"22293","GO:0060529",0,1,1,"squamous basal epithelial stem cell differentiation involved in prostate gland acinus development"
"22294","GO:0060534",0,3,1,"trachea cartilage development"
"22295","GO:0060535",0,2,1,"trachea cartilage morphogenesis"
"22296","GO:0060536",0,6,1,"cartilage morphogenesis"
"22297","GO:0060537",1,246,1,"muscle tissue development"
"22298","GO:0060538",1,144,1,"skeletal muscle organ development"
"22299","GO:0060539",0,4,1,"diaphragm development"
"22300","GO:0060541",0,134,1,"respiratory system development"
"22301","GO:0060544",0,3,1,"regulation of necroptosis"
"22302","GO:0060545",0,2,1,"positive regulation of necroptosis"
"22303","GO:0060546",0,1,1,"negative regulation of necroptosis"
