"","category","numDEInCat","numInCat","padj","Term"
"1393","GO:0002480",7,45,9.48809198052231e-06,"antigen processing and presentation of exogenous peptide antigen via MHC class I, TAP-independent"
"22104","GO:0060333",9,160,0.000176939410923268,"interferon-gamma-mediated signaling pathway"
"11582","GO:0034097",14,532,0.000269828472705213,"response to cytokine stimulus"
"23599","GO:0071346",9,179,0.000269828472705213,"cellular response to interferon-gamma"
"11740","GO:0034341",9,193,0.000354190737190718,"response to interferon-gamma"
"5973","GO:0010033",24,1695,0.000432019346268473,"response to organic substance"
"11739","GO:0034340",7,103,0.000432019346268473,"response to type I interferon"
"22124","GO:0060337",7,102,0.000432019346268473,"type I interferon-mediated signaling pathway"
"23609","GO:0071357",7,102,0.000432019346268473,"cellular response to type I interferon"
"23598","GO:0071345",12,462,0.00107052016231065,"cellular response to cytokine stimulus"
"4329","GO:0007166",25,1941,0.00125950697806021,"cell surface receptor signaling pathway"
"7463","GO:0019221",11,393,0.00125950697806021,"cytokine-mediated signaling pathway"
"13179","GO:0042221",27,2335,0.00245265046974634,"response to chemical stimulus"
"23566","GO:0071310",19,1255,0.00245265046974634,"cellular response to organic substance"
"1388","GO:0002479",7,147,0.00258429377917518,"antigen processing and presentation of exogenous peptide antigen via MHC class I, TAP-dependent"
"13778","GO:0042590",7,151,0.00290997590894009,"antigen processing and presentation of exogenous peptide antigen via MHC class I"
"6037","GO:0010243",11,466,0.00625566567647443,"response to organic nitrogen"
"12653","GO:0036109",3,10,0.00648079863701777,"alpha-linolenic acid metabolic process"
"1383","GO:0002474",7,178,0.00752246703422711,"antigen processing and presentation of peptide antigen via MHC class I"
"23379","GO:0070887",20,1541,0.00859662317658603,"cellular response to chemical stimulus"
"5778","GO:0009725",11,501,0.00912319798071186,"response to hormone stimulus"
"26852","GO:1901698",11,497,0.00912319798071186,"response to nitrogen compound"
"5776","GO:0009719",14,849,0.0140955389483447,"response to endogenous stimulus"
"10664","GO:0032787",9,355,0.0140955389483447,"monocarboxylic acid metabolic process"
"14686","GO:0043436",14,869,0.0140955389483447,"oxoacid metabolic process"
"2494","GO:0006082",14,877,0.0145022647560276,"organic acid metabolic process"
"10827","GO:0032868",7,202,0.0171385842831097,"response to insulin stimulus"
"14685","GO:0043434",8,278,0.0171385842831097,"response to peptide hormone stimulus"
"1387","GO:0002478",8,298,0.0176136543783615,"antigen processing and presentation of exogenous peptide antigen"
"15432","GO:0045087",11,571,0.0176136543783615,"innate immune response"
"7879","GO:0019884",8,300,0.0179714231120701,"antigen processing and presentation of exogenous antigen"
"26752","GO:1901652",8,287,0.0188448101003302,"response to peptide"
"865","GO:0001927",2,3,0.0192086010984908,"exocyst assembly"
"866","GO:0001928",2,3,0.0192086010984908,"regulation of exocyst assembly"
"18724","GO:0048583",23,2114,0.0192086010984908,"regulation of response to stimulus"
"3936","GO:0006868",2,3,0.0201505774864848,"glutamine transport"
"9609","GO:0031670",3,18,0.0220976312049883,"cellular response to nutrient"
"18269","GO:0048002",8,322,0.0242014507046701,"antigen processing and presentation of peptide antigen"
"5729","GO:0009605",14,985,0.0426066717068911,"response to external stimulus"
"7875","GO:0019882",8,352,0.0427385800516267,"antigen processing and presentation"
"1600","GO:0002682",13,893,0.0440754943354736,"regulation of immune system process"
"4332","GO:0007167",12,746,0.0440754943354736,"enzyme linked receptor protein signaling pathway"
"8256","GO:0022602",4,60,0.0440754943354736,"ovulation cycle process"
"9607","GO:0031668",5,113,0.0440754943354736,"cellular response to extracellular stimulus"
"11406","GO:0033559",4,64,0.0462858349524624,"unsaturated fatty acid metabolic process"
"4334","GO:0007169",10,541,0.0505713107623568,"transmembrane receptor protein tyrosine kinase signaling pathway"
"13841","GO:0042698",4,64,0.0528581651861461,"ovulation cycle"
"14897","GO:0043651",2,6,0.0715219341936,"linoleic acid metabolic process"
"4303","GO:0007154",32,3897,0.0841024091247843,"cell communication"
"4636","GO:0007411",7,282,0.0850427893292869,"axon guidance"
"1313","GO:0002376",18,1677,0.0968140045107106,"immune system process"
"4082","GO:0006952",13,995,0.101286456224446,"defense response"
"15473","GO:0045137",5,141,0.101286456224446,"development of primary sexual characteristics"
"528","GO:0001676",3,34,0.103869401731744,"long-chain fatty acid metabolic process"
"8295","GO:0023052",31,3810,0.112035562909442,"signaling"
"10829","GO:0032870",7,308,0.112035562909442,"cellular response to hormone stimulus"
"15186","GO:0044700",31,3810,0.112035562909442,"single organism signaling"
"4853","GO:0008286",5,145,0.11450447978503,"insulin receptor signaling pathway"
"4324","GO:0007165",29,3483,0.118109576654787,"signal transduction"
"7834","GO:0019752",11,775,0.121095012647864,"carboxylic acid metabolic process"
"24238","GO:0072330",5,154,0.121197275352228,"monocarboxylic acid biosynthetic process"
"12894","GO:0040011",13,995,0.121321667132766,"locomotion"
"3441","GO:0006636",3,40,0.130758106625284,"unsaturated fatty acid biosynthetic process"
"469","GO:0001542",2,9,0.134322300019243,"ovulation from ovarian follicle"
"6755","GO:0015849",5,159,0.134322300019243,"organic acid transport"
"18214","GO:0046942",5,159,0.134322300019243,"carboxylic acid transport"
"23714","GO:0071496",5,158,0.134322300019243,"cellular response to external stimulus"
"3935","GO:0006865",4,93,0.147015429230808,"amino acid transport"
"23555","GO:0071295",2,10,0.147221062299206,"cellular response to vitamin"
"4679","GO:0007548",5,163,0.14914909993996,"sex differentiation"
"9608","GO:0031669",4,97,0.16489179440855,"cellular response to nutrient levels"
"11284","GO:0033273",3,45,0.170456335350492,"response to vitamin"
"4694","GO:0007584",4,100,0.170691754574556,"response to nutrient"
"18746","GO:0048608",5,174,0.188461344387922,"reproductive structure development"
"19303","GO:0050776",9,587,0.188461344387922,"regulation of immune response"
"22731","GO:0061458",5,174,0.188461344387922,"reproductive system development"
"6729","GO:0015804",2,12,0.193871237144543,"neutral amino acid transport"
"3434","GO:0006631",6,270,0.198963012775981,"fatty acid metabolic process"
"10828","GO:0032869",5,176,0.198973791526374,"cellular response to insulin stimulus"
"15115","GO:0044283",7,376,0.212119731671213,"small molecule biosynthetic process"
"15194","GO:0044711",7,381,0.224958060995728,"single-organism biosynthetic process"
"3435","GO:0006633",4,113,0.229685888327598,"fatty acid biosynthetic process"
"8696","GO:0030539",2,14,0.232444508800542,"male genitalia development"
"23713","GO:0071495",9,595,0.232444508800542,"cellular response to endogenous stimulus"
"21147","GO:0051716",32,4279,0.244207916611802,"cellular response to stimulus"
"6692","GO:0015711",5,199,0.278591640037493,"organic anion transport"
"4914","GO:0008406",4,120,0.289845948009549,"gonad development"
"23217","GO:0070555",3,59,0.299431691034542,"response to interleukin-1"
"16084","GO:0045620",2,17,0.32472545154618,"negative regulation of lymphocyte differentiation"
"23643","GO:0071417",6,297,0.330092170386486,"cellular response to organic nitrogen"
"15193","GO:0044710",22,2634,0.338299885614161,"single-organism metabolic process"
"8737","GO:0030728",2,17,0.349371451701333,"ovulation"
"4633","GO:0007409",7,407,0.355007116612555,"axonogenesis"
"4926","GO:0008585",3,62,0.355007116612555,"female gonad development"
"6004","GO:0010165",2,18,0.355007116612555,"response to X-ray"
"18614","GO:0048511",4,130,0.355007116612555,"rhythmic process"
"19397","GO:0050850",2,19,0.355007116612555,"positive regulation of calcium-mediated signaling"
"4080","GO:0006950",22,2660,0.365798986848393,"response to stress"
"19124","GO:0050680",3,63,0.365798986848393,"negative regulation of epithelial cell proliferation"
"5943","GO:0009991",5,221,0.377619158480593,"response to extracellular stimulus"
"385","GO:0000904",8,560,0.392143209047916,"cell morphogenesis involved in differentiation"
"2378","GO:0006007",3,72,0.392143209047916,"glucose catabolic process"
"6733","GO:0015807",2,20,0.392143209047916,"L-amino acid transport"
"6747","GO:0015826",1,1,0.392143209047916,"threonine transport"
"6923","GO:0016053",5,245,0.392143209047916,"organic acid biosynthetic process"
"7379","GO:0018993",1,1,0.392143209047916,"somatic sex determination"
"7446","GO:0019102",1,1,0.392143209047916,"male somatic sex determination"
"8548","GO:0030300",1,1,0.392143209047916,"regulation of intestinal cholesterol absorption"
"10086","GO:0032371",2,21,0.392143209047916,"regulation of sterol transport"
"10096","GO:0032374",2,21,0.392143209047916,"regulation of cholesterol transport"
"11489","GO:0033684",1,1,0.392143209047916,"regulation of luteinizing hormone secretion"
"11490","GO:0033686",1,1,0.392143209047916,"positive regulation of luteinizing hormone secretion"
"11874","GO:0034589",1,1,0.392143209047916,"hydroxyproline transport"
"12655","GO:0036111",1,1,0.392143209047916,"very long-chain fatty-acyl-CoA metabolic process"
"12657","GO:0036112",1,1,0.392143209047916,"medium-chain fatty-acyl-CoA metabolic process"
"15113","GO:0044281",19,2216,0.392143209047916,"small molecule metabolic process"
"15138","GO:0044343",1,1,0.392143209047916,"canonical Wnt receptor signaling pathway involved in regulation of type B pancreatic cell proliferation"
"15143","GO:0044345",1,1,0.392143209047916,"stromal-epithelial cell signaling involved in prostate gland development"
"16327","GO:0045720",1,1,0.392143209047916,"negative regulation of integrin biosynthetic process"
"17620","GO:0046394",5,245,0.392143209047916,"carboxylic acid biosynthetic process"
"17796","GO:0046546",3,71,0.392143209047916,"development of primary male sexual characteristics"
"19555","GO:0050896",37,5442,0.392143209047916,"response to stimulus"
"22283","GO:0060514",1,1,0.392143209047916,"prostate induction"
"22287","GO:0060520",1,1,0.392143209047916,"activation of prostate induction by androgen receptor signaling pathway"
"22733","GO:0061469",1,1,0.392143209047916,"regulation of type B pancreatic cell proliferation"
"22768","GO:0070093",1,1,0.392143209047916,"negative regulation of glucagon secretion"
"23556","GO:0071298",1,1,0.392143209047916,"cellular response to L-ascorbic acid"
"23620","GO:0071375",5,226,0.392143209047916,"cellular response to peptide hormone stimulus"
"24687","GO:0090246",1,1,0.392143209047916,"convergent extension involved in somitogenesis"
"24705","GO:0090278",2,22,0.392143209047916,"negative regulation of peptide hormone secretion"
"24927","GO:0097350",1,1,0.392143209047916,"neutrophil clearance"
"26753","GO:1901653",5,226,0.392143209047916,"cellular response to peptide"
"26853","GO:1901699",6,319,0.392143209047916,"cellular response to nitrogen compound"
"27274","GO:2000079",1,1,0.392143209047916,"regulation of canonical Wnt receptor signaling pathway involved in controlling type B pancreatic cell proliferation"
"27278","GO:2000080",1,1,0.392143209047916,"negative regulation of canonical Wnt receptor signaling pathway involved in controlling type B pancreatic cell proliferation"
"27427","GO:2000271",1,1,0.392143209047916,"positive regulation of fibroblast apoptotic process"
"27743","GO:2000485",1,1,0.392143209047916,"regulation of glutamine transport"
"27744","GO:2000486",1,1,0.392143209047916,"negative regulation of glutamine transport"
"27813","GO:2000586",1,1,0.392143209047916,"regulation of platelet-derived growth factor receptor-beta signaling pathway"
"27817","GO:2000587",1,1,0.392143209047916,"negative regulation of platelet-derived growth factor receptor-beta signaling pathway"
"1860","GO:0002792",2,23,0.400492973881991,"negative regulation of peptide secretion"
"3903","GO:0006820",5,244,0.400492973881991,"anion transport"
"17961","GO:0046661",3,77,0.400492973881991,"male sex differentiation"
"18813","GO:0048667",7,447,0.400492973881991,"cell morphogenesis involved in neuron differentiation"
"22427","GO:0060740",2,23,0.400492973881991,"prostate gland epithelium morphogenesis"
"4090","GO:0006955",11,1009,0.404695828631036,"immune response"
"17795","GO:0046545",3,76,0.404695828631036,"development of primary female sexual characteristics"
"18940","GO:0048812",7,452,0.4123374240514,"neuron projection morphogenesis"
"17","GO:0000041",3,80,0.42254355886212,"transition metal ion transport"
"4067","GO:0006935",7,468,0.444562441171122,"chemotaxis"
"13320","GO:0042330",7,468,0.444562441171122,"taxis"
"17960","GO:0046660",3,80,0.444562441171122,"female sex differentiation"
"22279","GO:0060512",2,25,0.444562441171122,"prostate gland morphogenesis"
"7548","GO:0019320",3,83,0.444942041107093,"hexose catabolic process"
"4000","GO:0006904",2,27,0.470727469539733,"vesicle docking involved in exocytosis"
"18770","GO:0048638",3,82,0.470727469539733,"regulation of developmental growth"
"8217","GO:0022008",10,859,0.471765933357513,"neurogenesis"
"17593","GO:0046365",3,87,0.488176593243012,"monosaccharide catabolic process"
"19391","GO:0050848",2,28,0.488176593243012,"regulation of calcium-mediated signaling"
"6677","GO:0015682",2,28,0.492057429059469,"ferric iron transport"
"11414","GO:0033572",2,28,0.492057429059469,"transferrin transport"
"24300","GO:0072512",2,28,0.492057429059469,"trivalent inorganic cation transport"
"2512","GO:0006090",2,29,0.51018732405606,"pyruvate metabolic process"
"4815","GO:0008206",2,29,0.51018732405606,"bile acid metabolic process"
"8429","GO:0030182",9,738,0.51018732405606,"neuron differentiation"
"4967","GO:0008610",7,502,0.514598138050134,"lipid biosynthetic process"
"18477","GO:0048278",2,29,0.514598138050134,"vesicle docking"
"6564","GO:0014070",6,383,0.535573770022628,"response to organic cyclic compound"
"7711","GO:0019520",1,2,0.541054796345795,"aldonic acid metabolic process"
"7712","GO:0019521",1,2,0.541054796345795,"D-gluconate metabolic process"
"8396","GO:0030167",1,2,0.541054796345795,"proteoglycan catabolic process"
"8450","GO:0030200",1,2,0.541054796345795,"heparan sulfate proteoglycan catabolic process"
"11119","GO:0033029",1,2,0.541054796345795,"regulation of neutrophil apoptotic process"
"11120","GO:0033031",1,2,0.541054796345795,"positive regulation of neutrophil apoptotic process"
"18178","GO:0046888",2,30,0.541054796345795,"negative regulation of hormone secretion"
"92","GO:0000103",1,2,0.542648187801155,"sulfate assimilation"
"4813","GO:0008203",3,94,0.542648187801155,"cholesterol metabolic process"
"6734","GO:0015808",1,2,0.542648187801155,"L-alanine transport"
"11556","GO:0034036",1,2,0.542648187801155,"purine ribonucleoside bisphosphate biosynthetic process"
"11835","GO:0034439",1,2,0.542648187801155,"lipoprotein lipid oxidation"
"18812","GO:0048666",8,625,0.542648187801155,"neuron development"
"18937","GO:0048806",2,31,0.542648187801155,"genitalia development"
"19014","GO:0050428",1,2,0.542648187801155,"3'-phosphoadenosine 5'-phosphosulfate biosynthetic process"
"19841","GO:0051048",3,93,0.542648187801155,"negative regulation of secretion"
"21991","GO:0060206",1,2,0.542648187801155,"estrous cycle phase"
"22343","GO:0060587",1,2,0.542648187801155,"regulation of lipoprotein lipid oxidation"
"22353","GO:0060599",1,2,0.542648187801155,"lateral sprouting involved in mammary gland duct morphogenesis"
"22767","GO:0070092",1,2,0.542648187801155,"regulation of glucagon secretion"
"23625","GO:0071383",2,32,0.542648187801155,"cellular response to steroid hormone stimulus"
"27203","GO:2000040",1,2,0.542648187801155,"regulation of planar cell polarity pathway involved in axis elongation"
"27204","GO:2000041",1,2,0.542648187801155,"negative regulation of planar cell polarity pathway involved in axis elongation"
"27745","GO:2000489",1,2,0.542648187801155,"regulation of hepatic stellate cell activation"
"27746","GO:2000491",1,2,0.542648187801155,"positive regulation of hepatic stellate cell activation"
"9945","GO:0032275",1,2,0.54600114297266,"luteinizing hormone secretion"
"12297","GO:0035524",1,2,0.54600114297266,"proline transmembrane transport"
"27219","GO:2000054",1,2,0.548496176341709,"negative regulation of Wnt receptor signaling pathway involved in dorsal/ventral axis specification"
"23633","GO:0071396",4,182,0.552255717537964,"cellular response to lipid"
"22434","GO:0060748",1,2,0.563460517236367,"tertiary branching involved in mammary gland duct morphogenesis"
"7004","GO:0016125",3,100,0.59756698943258,"sterol metabolic process"
"3433","GO:0006629",10,955,0.617038603346768,"lipid metabolic process"
"15075","GO:0044262",4,191,0.636365431658324,"cellular carbohydrate metabolic process"
"381","GO:0000902",9,793,0.639887416558269,"cell morphogenesis"
"521","GO:0001666",4,192,0.639887416558269,"response to hypoxia"
"8235","GO:0022406",2,36,0.639887416558269,"membrane docking"
"17659","GO:0046456",2,37,0.639887416558269,"icosanoid biosynthetic process"
"26694","GO:1901570",2,37,0.639887416558269,"fatty acid derivative biosynthetic process"
"91","GO:0000101",1,3,0.644583142537985,"sulfur amino acid transport"
"518","GO:0001660",1,3,0.644583142537985,"fever generation"
"617","GO:0001781",1,3,0.644583142537985,"neutrophil apoptotic process"
"2088","GO:0003006",5,305,0.644583142537985,"developmental process involved in reproduction"
"2376","GO:0006006",4,200,0.644583142537985,"glucose metabolic process"
"2553","GO:0006114",1,3,0.644583142537985,"glycerol biosynthetic process"
"4812","GO:0008202",4,204,0.644583142537985,"steroid metabolic process"
"4895","GO:0008343",1,3,0.644583142537985,"adult feeding behavior"
"5027","GO:0009051",1,3,0.644583142537985,"pentose-phosphate shunt, oxidative branch"
"6486","GO:0014034",1,3,0.644583142537985,"neural crest cell fate commitment"
"6737","GO:0015811",1,3,0.644583142537985,"L-cystine transport"
"6745","GO:0015824",1,3,0.644583142537985,"proline transport"
"6746","GO:0015825",1,3,0.644583142537985,"L-serine transport"
"7628","GO:0019401",1,3,0.644583142537985,"alditol biosynthetic process"
"8972","GO:0030850",2,38,0.644583142537985,"prostate gland development"
"9399","GO:0031394",1,3,0.644583142537985,"positive regulation of prostaglandin biosynthetic process"
"9509","GO:0031620",1,3,0.644583142537985,"regulation of fever generation"
"9510","GO:0031622",1,3,0.644583142537985,"positive regulation of fever generation"
"9606","GO:0031667",4,202,0.644583142537985,"response to nutrient levels"
"9952","GO:0032278",1,3,0.644583142537985,"positive regulation of gonadotropin secretion"
"10017","GO:0032328",1,3,0.644583142537985,"alanine transport"
"11132","GO:0033034",1,3,0.644583142537985,"positive regulation of myeloid cell apoptotic process"
"11588","GO:0034109",2,38,0.644583142537985,"homotypic cell-cell adhesion"
"12444","GO:0035733",1,3,0.644583142537985,"hepatic stellate cell activation"
"12698","GO:0036293",4,193,0.644583142537985,"response to decreased oxygen levels"
"15927","GO:0045578",1,3,0.644583142537985,"negative regulation of B cell differentiation"
"16369","GO:0045726",1,3,0.644583142537985,"positive regulation of integrin biosynthetic process"
"18145","GO:0046881",1,3,0.644583142537985,"positive regulation of follicle-stimulating hormone secretion"
"18864","GO:0048699",9,806,0.644583142537985,"generation of neurons"
"22128","GO:0060341",7,548,0.644583142537985,"regulation of cellular localization"
"22398","GO:0060688",2,37,0.644583142537985,"regulation of morphogenesis of a branching structure"
"22766","GO:0070091",1,3,0.644583142537985,"glucagon secretion"
"23603","GO:0071347",2,39,0.644583142537985,"cellular response to interleukin-1"
"27425","GO:2000269",1,3,0.644583142537985,"regulation of fibroblast apoptotic process"
"27426","GO:2000270",1,3,0.644583142537985,"negative regulation of fibroblast apoptotic process"
"27578","GO:2000364",1,3,0.644583142537985,"regulation of STAT protein import into nucleus"
"27579","GO:2000366",1,3,0.644583142537985,"positive regulation of STAT protein import into nucleus"
"28384","GO:2001280",1,3,0.644583142537985,"positive regulation of unsaturated fatty acid biosynthetic process"
"12986","GO:0042063",3,110,0.647798125695902,"gliogenesis"
"11214","GO:0033143",2,40,0.652130229521605,"regulation of intracellular steroid hormone receptor signaling pathway"
"23168","GO:0070482",4,204,0.652130229521605,"response to oxygen levels"
"5921","GO:0009967",8,696,0.655237514071675,"positive regulation of signal transduction"
"7100","GO:0016477",8,690,0.658918290933041,"cell migration"
"18978","GO:0048858",7,550,0.662849924823921,"cell projection morphogenesis"
"8690","GO:0030522",4,205,0.663820045654063,"intracellular receptor mediated signaling pathway"
"3570","GO:0006694",3,115,0.663939123860849,"steroid biosynthetic process"
"27218","GO:2000053",1,3,0.663939123860849,"regulation of Wnt receptor signaling pathway involved in dorsal/ventral axis specification"
"11091","GO:0032989",9,833,0.68965870052725,"cellular component morphogenesis"
"9217","GO:0031175",7,559,0.69013018425128,"neuron projection development"
"3878","GO:0006811",8,710,0.693498668497002,"ion transport"
"10076","GO:0032368",2,43,0.707465935102389,"regulation of lipid transport"
"19835","GO:0051046",5,325,0.708170847721171,"regulation of secretion"
"11092","GO:0032990",7,563,0.714387638001019,"cell part morphogenesis"
"3907","GO:0006826",2,44,0.720781032510523,"iron ion transport"
"2417","GO:0006027",2,45,0.725970903404514,"glycosaminoglycan catabolic process"
"4176","GO:0007008",1,4,0.725970903404514,"outer mitochondrial membrane organization"
"6176","GO:0010647",8,722,0.725970903404514,"positive regulation of cell communication"
"7552","GO:0019322",1,4,0.725970903404514,"pentose biosynthetic process"
"7585","GO:0019362",2,47,0.725970903404514,"pyridine nucleotide metabolic process"
"8300","GO:0023056",8,721,0.725970903404514,"positive regulation of signaling"
"8547","GO:0030299",1,4,0.725970903404514,"intestinal cholesterol absorption"
"8594","GO:0030336",3,121,0.725970903404514,"negative regulation of cell migration"
"9946","GO:0032276",1,4,0.725970903404514,"regulation of gonadotropin secretion"
"10018","GO:0032329",1,4,0.725970903404514,"serine transport"
"11422","GO:0033591",1,4,0.725970903404514,"response to L-ascorbic acid"
"12389","GO:0035630",1,4,0.725970903404514,"bone mineralization involved in bone maturation"
"15032","GO:0044241",1,4,0.725970903404514,"lipid digestion"
"15066","GO:0044255",8,733,0.725970903404514,"cellular lipid metabolic process"
"15144","GO:0044346",1,4,0.725970903404514,"fibroblast apoptotic process"
"15198","GO:0044724",3,123,0.725970903404514,"single-organism carbohydrate catabolic process"
"15245","GO:0045040",1,4,0.725970903404514,"protein import into mitochondrial outer membrane"
"15454","GO:0045113",1,4,0.725970903404514,"regulation of integrin biosynthetic process"
"17738","GO:0046496",2,47,0.725970903404514,"nicotinamide nucleotide metabolic process"
"18143","GO:0046880",1,4,0.725970903404514,"regulation of follicle-stimulating hormone secretion"
"18285","GO:0048011",4,212,0.725970903404514,"nerve growth factor receptor signaling pathway"
"24907","GO:0097242",1,4,0.725970903404514,"beta-amyloid clearance"
"11265","GO:0033210",1,4,0.726220402109396,"leptin-mediated signaling pathway"
"9387","GO:0031392",1,4,0.730073029510875,"regulation of prostaglandin biosynthetic process"
"28378","GO:2001279",1,4,0.730073029510875,"regulation of unsaturated fatty acid biosynthetic process"
"23720","GO:0071504",1,4,0.73288873657763,"cellular response to heparin"
"2302","GO:0003402",1,4,0.735806369547899,"planar cell polarity pathway involved in axis elongation"
"2507","GO:0006089",1,4,0.735806369547899,"lactate metabolic process"
"6482","GO:0014029",1,4,0.735806369547899,"neural crest formation"
"6917","GO:0016052",3,127,0.735806369547899,"carbohydrate catabolic process"
"7039","GO:0016198",1,4,0.735806369547899,"axon choice point recognition"
"7040","GO:0016199",1,4,0.735806369547899,"axon midline choice point recognition"
"15134","GO:0044340",1,4,0.735806369547899,"canonical Wnt receptor signaling pathway involved in regulation of cell proliferation"
"16872","GO:0045906",1,4,0.735806369547899,"negative regulation of vasoconstriction"
"22432","GO:0060745",1,4,0.735806369547899,"mammary gland branching involved in pregnancy"
"23884","GO:0071705",6,465,0.735806369547899,"nitrogen compound transport"
"27214","GO:2000051",1,4,0.735806369547899,"negative regulation of non-canonical Wnt receptor signaling pathway"
"27347","GO:2000146",3,124,0.735806369547899,"negative regulation of cell motility"
"8349","GO:0030073",3,126,0.770050358199824,"insulin secretion"
"18939","GO:0048808",1,5,0.794074589930457,"male genitalia morphogenesis"
"20302","GO:0051271",3,129,0.794074589930457,"negative regulation of cellular component movement"
"2414","GO:0006026",2,51,0.794663288917142,"aminoglycan catabolic process"
"6724","GO:0015802",1,5,0.794663288917142,"basic amino acid transport"
"6814","GO:0015918",2,52,0.794663288917142,"sterol transport"
"7543","GO:0019318",4,233,0.794663288917142,"hexose metabolic process"
"8463","GO:0030204",2,49,0.794663288917142,"chondroitin sulfate metabolic process"
"8549","GO:0030301",2,52,0.794663288917142,"cholesterol transport"
"9560","GO:0031652",1,5,0.794663288917142,"positive regulation of heat generation"
"9944","GO:0032274",1,5,0.794663288917142,"gonadotropin secretion"
"12467","GO:0035791",1,5,0.794663288917142,"platelet-derived growth factor receptor-beta signaling pathway"
"15450","GO:0045112",1,5,0.794663288917142,"integrin biosynthetic process"
"17859","GO:0046628",1,5,0.794663288917142,"positive regulation of insulin receptor signaling pathway"
"18157","GO:0046884",1,5,0.794663288917142,"follicle-stimulating hormone secretion"
